{
  "request_id": "fixture-request-03",
  "session_id": "fixture-session-03",
  "created_at": "2026-01-01T00:00:03Z",
  "overlays": [
    {
      "label": "Hot surface warning",
      "bbox": {
        "x": 0.11,
        "y": 0.35,
        "width": 0.31,
        "height": 0.49
      },
      "confidence": 0.86,
      "overlay_type": "hazard",
      "ui_layer": "foreground",
      "action_required": true
    }
  ]
}
