{
  "request_id": "fixture-request-02",
  "session_id": "fixture-session-02",
  "created_at": "2026-01-01T00:00:02Z",
  "overlays": [
    {
      "label": "Power connector",
      "bbox": {
        "x": 0.58,
        "y": 0.4,
        "width": 0.21,
        "height": 0.32
      },
      "confidence": 0.89,
      "overlay_type": "info",
      "ui_layer": "midground",
      "action_required": false
    }
  ]
}
