{
  "request_id": "fixture-request-04",
  "session_id": "fixture-session-04",
  "created_at": "2026-01-01T00:00:04Z",
  "overlays": [
    {
      "label": "Reference panel",
      "bbox": {
        "x": 0.31,
        "y": 0.18,
        "width": 0.35,
        "height": 0.31
      },
      "confidence": 0.91,
      "overlay_type": "reference",
      "ui_layer": "background",
      "action_required": false
    }
  ]
}
